<?xml version="1.0" encoding="UTF-8"?>
<!DOCTYPE Configuration PUBLIC "" "Configuration.dtd"[


<!ENTITY TargetLumi  "1" >
<!ENTITY outfilepath "/work/areimers/LQDM/GENSIM/analysisfiles" >


<!ENTITY LQLQToBTau_MLQ1000_MPS574_MC1427_L1p0        SYSTEM "/work/areimers/LQDM/macros/datasets/UL17/LQLQToBTau_MLQ1000_MPS574_MC1427_L1p0.xml"        >
<!ENTITY LQLQToBTau_MLQ1000_MPS983_MC1912_L1p0        SYSTEM "/work/areimers/LQDM/macros/datasets/UL17/LQLQToBTau_MLQ1000_MPS983_MC1912_L1p0.xml"        >
<!ENTITY LQLQToBTau_MLQ1900_MPS475_MC1427_L1p0        SYSTEM "/work/areimers/LQDM/macros/datasets/UL17/LQLQToBTau_MLQ1900_MPS475_MC1427_L1p0.xml"        >
<!ENTITY LQLQToBTau_MLQ1900_MPS1064_MC1794_L1p0       SYSTEM "/work/areimers/LQDM/macros/datasets/UL17/LQLQToBTau_MLQ1900_MPS1064_MC1794_L1p0.xml"       >
<!ENTITY LQLQToBTauPsiChi_MLQ1000_MPS574_MC1427_L1p0  SYSTEM "/work/areimers/LQDM/macros/datasets/UL17/LQLQToBTauPsiChi_MLQ1000_MPS574_MC1427_L1p0.xml"  >
<!ENTITY LQLQToBTauPsiChi_MLQ1900_MPS475_MC1427_L1p0  SYSTEM "/work/areimers/LQDM/macros/datasets/UL17/LQLQToBTauPsiChi_MLQ1900_MPS475_MC1427_L1p0.xml"  >
<!ENTITY LQLQToBTauPsiChi_MLQ1900_MPS1064_MC1794_L1p0 SYSTEM "/work/areimers/LQDM/macros/datasets/UL17/LQLQToBTauPsiChi_MLQ1900_MPS1064_MC1794_L1p0.xml" >
<!ENTITY LQLQToPsiChi_MLQ1000_MPS574_MC1427_L1p0      SYSTEM "/work/areimers/LQDM/macros/datasets/UL17/LQLQToPsiChi_MLQ1000_MPS574_MC1427_L1p0.xml"      >
<!ENTITY LQLQToPsiChi_MLQ1900_MPS475_MC1427_L1p0      SYSTEM "/work/areimers/LQDM/macros/datasets/UL17/LQLQToPsiChi_MLQ1900_MPS475_MC1427_L1p0.xml"      >
<!ENTITY LQLQToPsiChi_MLQ1900_MPS1064_MC1794_L1p0     SYSTEM "/work/areimers/LQDM/macros/datasets/UL17/LQLQToPsiChi_MLQ1900_MPS1064_MC1794_L1p0.xml"     >
<!ENTITY PsiPsiToLQChi_MLQ1000_MPS574_MC1427_L1p0     SYSTEM "/work/areimers/LQDM/macros/datasets/UL17/PsiPsiToLQChi_MLQ1000_MPS574_MC1427_L1p0.xml"     >
<!ENTITY PsiPsiToLQChi_MLQ1000_MPS983_MC1912_L1p0     SYSTEM "/work/areimers/LQDM/macros/datasets/UL17/PsiPsiToLQChi_MLQ1000_MPS983_MC1912_L1p0.xml"     >
<!ENTITY PsiPsiToLQChi_MLQ1900_MPS475_MC1427_L1p0     SYSTEM "/work/areimers/LQDM/macros/datasets/UL17/PsiPsiToLQChi_MLQ1900_MPS475_MC1427_L1p0.xml"     >
<!ENTITY PsiPsiToLQChi_MLQ1900_MPS1064_MC1794_L1p0    SYSTEM "/work/areimers/LQDM/macros/datasets/UL17/PsiPsiToLQChi_MLQ1900_MPS1064_MC1794_L1p0.xml"    >

]>


<Configuration OutputDirectory="&outfilepath;" PostFix="" TargetLumi="&TargetLumi;" AnalysisTool="GenlevelTool">
    <InputDatasets>
<!--
        <Dataset Name="LQLQToBTau_MLQ1000_MPS574_MC1427_L1p0"         Lumi="100000"  Type="MC" >
            &LQLQToBTau_MLQ1000_MPS574_MC1427_L1p0;
        </Dataset>

        <Dataset Name="LQLQToBTau_MLQ1000_MPS983_MC1912_L1p0"         Lumi="100000"  Type="MC" >
            &LQLQToBTau_MLQ1000_MPS983_MC1912_L1p0;
        </Dataset>
-->
        <Dataset Name="LQLQToBTau_MLQ1900_MPS475_MC1427_L1p0"         Lumi="100000"  Type="MC" >
            &LQLQToBTau_MLQ1900_MPS475_MC1427_L1p0;
        </Dataset>
<!--
        <Dataset Name="LQLQToBTau_MLQ1900_MPS1064_MC1794_L1p0"        Lumi="100000"  Type="MC" >
            &LQLQToBTau_MLQ1900_MPS1064_MC1794_L1p0;
        </Dataset>

        <Dataset Name="LQLQToBTauPsiChi_MLQ1000_MPS574_MC1427_L1p0"   Lumi="100000"  Type="MC" >
            &LQLQToBTauPsiChi_MLQ1000_MPS574_MC1427_L1p0;
        </Dataset>
-->
        <Dataset Name="LQLQToBTauPsiChi_MLQ1900_MPS475_MC1427_L1p0"   Lumi="100000"  Type="MC" >
            &LQLQToBTauPsiChi_MLQ1900_MPS475_MC1427_L1p0;
        </Dataset>
<!--
        <Dataset Name="LQLQToBTauPsiChi_MLQ1900_MPS1064_MC1794_L1p0"  Lumi="100000"  Type="MC" >
            &LQLQToBTauPsiChi_MLQ1900_MPS1064_MC1794_L1p0;
        </Dataset>

        <Dataset Name="LQLQToPsiChi_MLQ1000_MPS574_MC1427_L1p0"       Lumi="100000"  Type="MC" >
            &LQLQToPsiChi_MLQ1000_MPS574_MC1427_L1p0;
        </Dataset>
-->
        <Dataset Name="LQLQToPsiChi_MLQ1900_MPS475_MC1427_L1p0"       Lumi="100000"  Type="MC" >
            &LQLQToPsiChi_MLQ1900_MPS475_MC1427_L1p0;
        </Dataset>
<!--
        <Dataset Name="LQLQToPsiChi_MLQ1900_MPS1064_MC1794_L1p0"      Lumi="100000"  Type="MC" >
            &LQLQToPsiChi_MLQ1900_MPS1064_MC1794_L1p0;
        </Dataset>

        <Dataset Name="PsiPsiToLQChi_MLQ1000_MPS574_MC1427_L1p0"      Lumi="100000"  Type="MC" >
            &PsiPsiToLQChi_MLQ1000_MPS574_MC1427_L1p0;
        </Dataset>

        <Dataset Name="PsiPsiToLQChi_MLQ1000_MPS983_MC1912_L1p0"      Lumi="100000"  Type="MC" >
            &PsiPsiToLQChi_MLQ1000_MPS983_MC1912_L1p0;
        </Dataset>
-->
        <Dataset Name="PsiPsiToLQChi_MLQ1900_MPS475_MC1427_L1p0"      Lumi="100000"  Type="MC" >
            &PsiPsiToLQChi_MLQ1900_MPS475_MC1427_L1p0;
        </Dataset>
<!--
        <Dataset Name="PsiPsiToLQChi_MLQ1900_MPS1064_MC1794_L1p0"     Lumi="100000"  Type="MC" >
            &PsiPsiToLQChi_MLQ1900_MPS1064_MC1794_L1p0;
        </Dataset>
-->
    </InputDatasets>

    <AdditionalVariables>
        <Variable Name="test" Value="testvalue"/>
    </AdditionalVariables>
</Configuration>
