<?xml version="1.0" encoding="UTF-8"?>
<!DOCTYPE Configuration PUBLIC "" "Configuration.dtd"[


<!ENTITY TargetLumi  "1" >
<!ENTITY outfilepath "/pnfs/psi.ch/cms/trivcat/store/user/$MYUSERNAME/$MYANALYSISNAME/2017/Preselection/InitialSetup" >


<!ENTITY LQLQToBTau_MLQ1000_MPS117_MC1100_L1p0   SYSTEM "$MYANALYZERPATH/datasets/UL17/Summer20/MINIAOD/LQLQToBTau_MLQ1000_MPS117_MC1100_L1p0.xml" >
<!ENTITY LQLQToBTau_MLQ1360_MPS117_MC1100_L1p0   SYSTEM "$MYANALYZERPATH/datasets/UL17/Summer20/MINIAOD/LQLQToBTau_MLQ1360_MPS117_MC1100_L1p0.xml" >
<!ENTITY WJetsToLNu_Inclusive                    SYSTEM "$MYANALYZERPATH/datasets/UL17/Summer20/MINIAOD/WJetsToLNu_Inclusive.xml" >

]>


<Configuration OutputDirectory="&outfilepath;" PostFix="" SEDirector="root://t3dcachedb03.psi.ch/" TargetLumi="&TargetLumi;" AnalysisTool="$MYTOOLNAME">

  <SubmissionSettings EventsPerJob="-1" FilesPerJob="-1" Walltime="01:00:00" />

  <InputDatasets>
    <Dataset Name="LQLQToBTau_MLQ1000_MPS117_MC1100_L1p0"  Lumi="100000"         Year="2017"  Type="MC"  Group="None"  >    &LQLQToBTau_MLQ1000_MPS117_MC1100_L1p0;    </Dataset>
    <Dataset Name="LQLQToBTau_MLQ1360_MPS117_MC1100_L1p0"  Lumi="100000"         Year="2017"  Type="MC"  Group="None"  >    &LQLQToBTau_MLQ1360_MPS117_MC1100_L1p0;    </Dataset>
    <Dataset Name="WJetsToLNu_Inclusive"                   Lumi="19997.57806"    Year="2017"  Type="MC"  Group="WJets" >    &WJetsToLNu_Inclusive;                     </Dataset>
  </InputDatasets>

  <AdditionalVariables>
    <Variable Name="test" Value="testvalue"/>
  </AdditionalVariables>

</Configuration>
